{
  "$schema": "http://json-schema.org/draft-07/schema#",
  "title": "Spell effects",
  "description": "Schema for seeds/spell_effects.json: one structured entry per spell the engine tracks. The Wizard entries were extracted once by an agent from the spell text; the Priest entries at the end of the file are written by scripts/priest-effects-audit.py from scripts/priest-effects/effects.json (docs/priest-effects-audit.md lists every Priest spell). A Priest spell that shares its name with a Wizard spell has the id suffix _priest (and _l<level> for a higher level), as in the catalogue. The Go loader (api/internal/adapters/spelleffectsadpt) is the authority and additionally parses every formula; formulas use the grammar documented in api/pkg/formula. Spell ids are the catalogue's: the snake_case slug of the English name (lowercase, apostrophes dropped, other non-alphanumerics become '_'), with the suffixes above.",
  "type": "array",
  "items": {
    "type": "object",
    "additionalProperties": false,
    "required": ["id", "name", "level", "kind", "confidence", "target", "duration"],
    "properties": {
      "id": { "type": "string", "pattern": "^[a-z0-9]+(_[a-z0-9]+)*$", "description": "Slug of name, e.g. melfs_acid_arrow" },
      "name": { "type": "string", "description": "Spell name exactly as in spells.json" },
      "level": { "type": "integer", "minimum": 1, "maximum": 9 },
      "kind": { "enum": ["buff", "damage", "utility"], "description": "buff = modifies a creature for a while (debuffs included); damage = deals hit-point damage; utility = nothing the engine tracks numerically" },
      "confidence": { "enum": ["high", "low"], "description": "low = extraction partial or unsure; a note is then required" },
      "note": { "type": "string", "description": "Caveats, what is not modelled, source ambiguities. Required when confidence is low." },
      "target": { "enum": ["self", "other", "self_or_other", "area", "none"] },
      "duration": {
        "type": "object",
        "additionalProperties": false,
        "required": ["kind"],
        "properties": {
          "kind": { "enum": ["rounds", "instant", "permanent", "until_discharged", "special"] },
          "rounds": { "$ref": "#/definitions/formula", "description": "Only with kind rounds. 1 turn = 10 rounds, 1 hour = 60 rounds, 1 day = 1440 rounds." }
        }
      },
      "charges": {
        "type": "object",
        "additionalProperties": false,
        "required": ["count", "unit"],
        "description": "A pool consumed instead of (or besides) time, e.g. Stoneskin attacks, Mirror Image images.",
        "properties": {
          "count": { "$ref": "#/definitions/formula" },
          "unit": { "type": "string", "description": "What one charge is: attacks, images, hp_damage_taken..." }
        }
      },
      "save": {
        "type": "object",
        "additionalProperties": false,
        "required": ["type", "effect"],
        "properties": {
          "type": { "enum": ["none", "spell", "poison", "paralyzation", "death", "petrification", "breath", "rod_staff_wand", "polymorph"] },
          "effect": { "enum": ["half", "negates", "none", "special"] }
        }
      },
      "damage": {
        "type": "object",
        "additionalProperties": false,
        "description": "Exactly one of dice, by_level, parts and steps. A spell with modes has no damage of its own: each mode carries its own.",
        "properties": {
          "dice": { "$ref": "#/definitions/formula", "description": "Damage of one instance, e.g. (min(level,10))d6 for Fireball" },
          "by_level": {
            "type": "array",
            "description": "Table keyed by caster level; first row min_level 1, ascending; the last row with min_level <= level applies.",
            "items": {
              "type": "object",
              "additionalProperties": false,
              "required": ["min_level", "dice"],
              "properties": { "min_level": { "type": "integer", "minimum": 1 }, "dice": { "$ref": "#/definitions/formula" } }
            }
          },
          "parts": {
            "type": "array",
            "minItems": 1,
            "description": "One instance split into parts rolled separately, each with what a save does to it, so the GM can drop the part a save negates (docs/adr/0008 step 13). The instance is the parts added up, in this order.",
            "items": {
              "type": "object",
              "additionalProperties": false,
              "description": "Exactly one of dice and by_level (same rules as the damage's).",
              "properties": {
                "dice": { "$ref": "#/definitions/formula" },
                "by_level": { "$ref": "#/items/properties/damage/properties/by_level" },
                "save": { "enum": ["none", "negates"], "description": "What a successful save does to this part. Default: the entry's save effect, which must then be none or negates." }
              }
            }
          },
          "steps": {
            "type": "object",
            "additionalProperties": false,
            "required": ["per"],
            "description": "Dice that change from one round, or one instance, to the next (docs/adr/0008 step 15): exactly one of dice (with count) and list. Their formulas may use step, the 1-based step number; a step may have no damage (0), and the steps after the last one with damage are dropped. Replaces instances and rounds: the steps are the rounds or the instances.",
            "properties": {
              "per": { "enum": ["round", "instance"], "description": "What one step is: a round of a lasting damage, or one separate roll of the casting." },
              "dice": { "$ref": "#/definitions/formula", "description": "The formula of every step, e.g. (max(min(level,12)-(step-1),0))d6 for Chain Lightning (cap a decreasing dice count at 0)." },
              "count": { "$ref": "#/definitions/formula", "description": "With dice: how many steps at most (no dice, 1 to 100 at every level)." },
              "list": { "type": "array", "minItems": 1, "maxItems": 100, "items": { "$ref": "#/definitions/formula" }, "description": "The formula of each step, in order, e.g. [0, 0, \"leveld2\", \"leveld4\", \"leveld2\"] for Incendiary Cloud." }
            }
          },
          "instances": { "$ref": "#/definitions/formula", "description": "Separate damage rolls per casting (missiles, bolts). Default 1." },
          "rounds": { "$ref": "#/definitions/formula", "description": "Rounds over which the damage repeats (Melf's Acid Arrow). Default 1." },
          "type": { "type": "string", "description": "Damage type: fire, cold, acid, force..." }
        }
      },
      "modes": {
        "type": "array",
        "minItems": 2,
        "description": "Cast-time options, picked by the caster when casting (the first is the default), each with its own damage or none (docs/adr/0008 step 14). Only on a damage spell, instead of its damage; keys are unique; at least one mode has damage. Each mode's damage uses the entry's save.",
        "items": {
          "type": "object",
          "additionalProperties": false,
          "required": ["key"],
          "properties": {
            "key": { "type": "string", "pattern": "^[a-z0-9]+(_[a-z0-9]+)*$", "description": "snake_case, unique in the spell; the UI words it (spellMode.<spell id>.<key>)" },
            "damage": { "$ref": "#/items/properties/damage", "description": "The damage a cast in this mode rolls; absent: none." }
          }
        }
      },
      "exposure": {
        "type": "object",
        "additionalProperties": false,
        "description": "The damage of one round of exposure to the area the spell leaves, rolled on request by the player for whoever is in it or passes through it (docs/adr/0008 step 16). Only on a damage spell, which may then have no damage of its own. Set exactly one of damage and modes. The damage is one roll per round: no instances or rounds; steps only per round, a step being the round of exposure (a later round rolls the last step).",
        "properties": {
          "damage": { "$ref": "#/items/properties/damage" },
          "modes": {
            "type": "array",
            "minItems": 2,
            "description": "Options picked at each exposure (the first is the default), each with its damage; keys are unique.",
            "items": {
              "type": "object",
              "additionalProperties": false,
              "required": ["key", "damage"],
              "properties": {
                "key": { "type": "string", "pattern": "^[a-z0-9]+(_[a-z0-9]+)*$", "description": "snake_case, unique in the exposure; the UI words it (spellMode.<spell id>.<key>)" },
                "damage": { "$ref": "#/items/properties/damage" }
              }
            }
          }
        }
      },
      "modifiers": {
        "type": "object",
        "additionalProperties": false,
        "description": "Scalar buff modifiers, each a formula (a bare number is fine). Signs: to_hit, damage, save, weapon_buff positive = better for the bearer; ac is a change to the AC number, so negative improves AC (descending AC); ac_set* make the AC at best that value and never worsen it; attackers_to_hit is applied to attack rolls made against the bearer; *_pct are percentages (100 = unchanged).",
        "properties": {
          "to_hit": { "$ref": "#/definitions/formula" },
          "damage": { "$ref": "#/definitions/formula" },
          "ac": { "$ref": "#/definitions/formula" },
          "ac_set": { "$ref": "#/definitions/formula" },
          "ac_set_thrown": { "$ref": "#/definitions/formula" },
          "ac_set_missile": { "$ref": "#/definitions/formula" },
          "ac_set_other": { "$ref": "#/definitions/formula" },
          "save": { "$ref": "#/definitions/formula" },
          "attackers_to_hit": { "$ref": "#/definitions/formula" },
          "attackers_to_hit_first": { "$ref": "#/definitions/formula", "description": "Replaces attackers_to_hit for the first attack against the bearer" },
          "initiative": { "$ref": "#/definitions/formula" },
          "move_pct": { "$ref": "#/definitions/formula" },
          "attacks_pct": { "$ref": "#/definitions/formula" },
          "damage_multiplier_pct": { "$ref": "#/definitions/formula", "description": "Multiplies each damage roll, rounded up (Enlarge: 100+10*level)" },
          "weapon_buff": { "$ref": "#/definitions/formula", "description": "Magical plus on to-hit and damage" },
          "regen_hp_per_round": { "$ref": "#/definitions/formula" }
        }
      },
      "ability_gain": {
        "type": "object",
        "description": "Ability score increases keyed by str, dex, con, int, wis or cha. Set exactly one of gain and by_group. Groups: warrior, priest, rogue, wizard (a bard is a rogue).",
        "propertyNames": { "enum": ["str", "dex", "con", "int", "wis", "cha"] },
        "additionalProperties": {
          "type": "object",
          "additionalProperties": false,
          "properties": {
            "gain": { "$ref": "#/definitions/formula" },
            "by_group": { "type": "object", "propertyNames": { "enum": ["warrior", "priest", "rogue", "wizard"] }, "additionalProperties": { "$ref": "#/definitions/formula" } },
            "max": { "type": "integer", "minimum": 0, "maximum": 30, "description": "Score cannot exceed this" },
            "max_by_group": { "type": "object", "propertyNames": { "enum": ["warrior", "priest", "rogue", "wizard"] }, "additionalProperties": { "type": "integer", "minimum": 1, "maximum": 30 } }
          }
        }
      },
      "ability_set": {
        "type": "object",
        "description": "Ability score forced to a value, e.g. Fist of Stone sets str to 18/00.",
        "propertyNames": { "enum": ["str", "dex", "con", "int", "wis", "cha"] },
        "additionalProperties": { "type": ["string", "number"] }
      },
      "condition": { "type": "string", "description": "When the buff's modifiers apply, if not always. A conditional modifier is shown, never applied." },
      "condition_keys": {
        "type": "array",
        "minItems": 1,
        "uniqueItems": true,
        "items": { "type": "string" },
        "description": "The modifiers the condition limits (each one a key of modifiers); the others apply always. Without it the condition limits every modifier."
      },
      "grant_slots": {
        "type": "object",
        "additionalProperties": false,
        "required": ["levels"],
        "description": "Cast mechanic: casting adds blank extra spell slots worth this many spell levels in all, split by the caster at cast time (default: all level 1). Extra slots go at the long rest (docs/adr/0008 step 9).",
        "properties": { "levels": { "type": "integer", "minimum": 1, "maximum": 9 } }
      },
      "consume_item": {
        "type": "object",
        "additionalProperties": false,
        "required": ["type"],
        "description": "Cast mechanic: casting spends one unit of an inventory item of this type (never a daily item), chosen by the caster when several are left (docs/adr/0008 step 10).",
        "properties": { "type": { "type": "string" } }
      },
      "attack_roll": { "type": "boolean", "description": "Cast mechanic: casting needs a target AC and rolls one spell to-hit d20, never a crit (docs/adr/0002 Consequences)." },
      "end_effects": {
        "type": "array",
        "minItems": 1,
        "description": "Effects that apply when the spell's row ends (docs/adr/0004 step 21), each by the causes it names. Stopping a row whose spell has any asks the player how it ended.",
        "items": {
          "type": "object",
          "additionalProperties": false,
          "required": ["kind", "dice", "on"],
          "properties": {
            "kind": { "enum": ["heal"], "description": "heal = the bearer regains the dice in hit points (capped at max HP by the ledger)" },
            "dice": { "$ref": "#/definitions/formula", "description": "A sum of dice plus a constant; may not use level (the row keeps no caster level)." },
            "on": {
              "type": "array",
              "minItems": 1,
              "uniqueItems": true,
              "items": { "enum": ["expired", "voluntary", "dispelled"] },
              "description": "expired = runs out (Next Round or passing time takes its last round); voluntary = ended by the player; dispelled = dispelled, or its bearer slain."
            }
          }
        }
      }
    }
  },
  "definitions": {
    "formula": {
      "description": "Integer expression over INT, dice NdM, 'level', + - * /, parentheses, min(a,b), max(a,b). 'leveld6' rolls level d6; '(min(level,10))d6' caps the dice. Division truncates. 'step' (only in damage.steps) is the 1-based step number. See api/pkg/formula.",
      "type": ["string", "number"]
    }
  }
}
