[
 {
  "id": "alarm",
  "name": "Alarm",
  "level": 1,
  "kind": "utility",
  "confidence": "high",
  "target": "none",
  "duration": {
   "kind": "special"
  }
 },
 {
  "id": "armor",
  "name": "Armor",
  "level": 1,
  "kind": "buff",
  "confidence": "high",
  "note": "Sets AC to 6 (never worsens it); not cumulative with the shield spell. Ends when cumulative damage taken exceeds 8 + level; the armor does not absorb that damage.",
  "target": "self_or_other",
  "duration": {
   "kind": "until_discharged"
  },
  "charges": {
   "count": "8+level",
   "unit": "hp_damage_taken"
  },
  "modifiers": {
   "ac_set": 6
  }
 },
 {
  "id": "burning_hands",
  "name": "Burning Hands",
  "level": 1,
  "kind": "damage",
  "confidence": "high",
  "target": "area",
  "duration": {
   "kind": "instant"
  },
  "save": {
   "type": "spell",
   "effect": "half"
  },
  "damage": {
   "dice": "1d3+2*min(level,10)",
   "type": "fire"
  }
 },
 {
  "id": "chromatic_orb",
  "name": "Chromatic Orb",
  "level": 1,
  "kind": "utility",
  "confidence": "high",
  "note": "The gem's effect on a hit is the DM's call: the app spends the gem and rolls the to-hit only.",
  "target": "other",
  "duration": {
   "kind": "instant"
  },
  "consume_item": {
   "type": "gem"
  },
  "attack_roll": true
 },
 {
  "id": "enlarge",
  "name": "Enlarge",
  "level": 1,
  "kind": "buff",
  "confidence": "high",
  "note": "Damage rolls grow proportionally with size: multiplier = 100% + 10% per caster level, result rounded up. Hit points, AC, attack rolls and Strength/class/magic bonuses are unchanged. Unwilling targets save to negate. Reverse spell: reduce.",
  "target": "self_or_other",
  "duration": {
   "kind": "rounds",
   "rounds": "5*level"
  },
  "save": {
   "type": "spell",
   "effect": "negates"
  },
  "modifiers": {
   "damage_multiplier_pct": "100+10*level"
  }
 },
 {
  "id": "fist_of_stone",
  "name": "Fist of Stone",
  "level": 1,
  "kind": "buff",
  "confidence": "high",
  "note": "Fist attacks as if Strength 18/00 (combat bonuses only for the fist). Caster cannot cast spells with somatic components meanwhile.",
  "target": "self",
  "duration": {
   "kind": "rounds",
   "rounds": "level"
  },
  "ability_set": {
   "str": "18/00"
  }
 },
 {
  "id": "identify",
  "name": "Identify",
  "level": 1,
  "kind": "utility",
  "confidence": "high",
  "target": "none",
  "duration": {
   "kind": "rounds",
   "rounds": "level"
  }
 },
 {
  "id": "light",
  "name": "Light",
  "level": 1,
  "kind": "utility",
  "confidence": "high",
  "target": "none",
  "duration": {
   "kind": "rounds",
   "rounds": "10*level"
  }
 },
 {
  "id": "magic_missile",
  "name": "Magic Missile",
  "level": 1,
  "kind": "damage",
  "confidence": "high",
  "note": "Each missile 1d4+1; one missile at level 1, +1 per two further levels, max 5 (level 9). Never misses; may be split between targets.",
  "target": "other",
  "duration": {
   "kind": "instant"
  },
  "save": {
   "type": "none",
   "effect": "none"
  },
  "damage": {
   "dice": "1d4+1",
   "instances": "min(5,1+(level-1)/2)",
   "type": "force"
  }
 },
 {
  "id": "sleep",
  "name": "Sleep",
  "level": 1,
  "kind": "utility",
  "confidence": "high",
  "note": "Affects 2d4 Hit Dice of creatures (none with 4+3 HD or more), weakest first; no save.",
  "target": "area",
  "duration": {
   "kind": "rounds",
   "rounds": "5*level"
  }
 },
 {
  "id": "melfs_acid_arrow",
  "name": "Melf's Acid Arrow",
  "level": 2,
  "kind": "damage",
  "confidence": "high",
  "note": "Hits as a fighter of the caster's level (no range modifiers). 2d4 acid per round; the acid lasts 1 round plus 1 per three levels. Saving throws only for items.",
  "target": "other",
  "duration": {
   "kind": "rounds",
   "rounds": "1+level/3"
  },
  "damage": {
   "dice": "2d4",
   "rounds": "1+level/3",
   "type": "acid"
  }
 },
 {
  "id": "mirror_image",
  "name": "Mirror Image",
  "level": 2,
  "kind": "buff",
  "confidence": "high",
  "note": "1d4 images plus 1 per three levels, max 8. Each image vanishes when an attack is aimed at it.",
  "target": "self",
  "duration": {
   "kind": "rounds",
   "rounds": "3*level"
  },
  "charges": {
   "count": "min(8,1d4+level/3)",
   "unit": "images"
  }
 },
 {
  "id": "strength",
  "name": "Strength",
  "level": 2,
  "kind": "buff",
  "confidence": "high",
  "note": "Strength gain by class group (a bard is a rogue: 1d6). Never confers 19 or more; not cumulative with other Strength magic. A warrior with 18 Strength instead adds 10%-80% to the exceptional roll (not modelled). Creatures with no Strength score get +1 to attack and damage.",
  "target": "self_or_other",
  "duration": {
   "kind": "rounds",
   "rounds": "60*level"
  },
  "ability_gain": {
   "str": {
    "by_group": {
     "priest": "1d6",
     "rogue": "1d6",
     "warrior": "1d8",
     "wizard": "1d4"
    },
    "max": 18
   }
  }
 },
 {
  "id": "dispel_magic",
  "name": "Dispel Magic",
  "level": 3,
  "kind": "utility",
  "confidence": "high",
  "target": "none",
  "duration": {
   "kind": "instant"
  }
 },
 {
  "id": "fireball",
  "name": "Fireball",
  "level": 3,
  "kind": "damage",
  "confidence": "high",
  "target": "area",
  "duration": {
   "kind": "instant"
  },
  "save": {
   "type": "spell",
   "effect": "half"
  },
  "damage": {
   "dice": "(min(level,10))d6",
   "type": "fire"
  }
 },
 {
  "id": "haste",
  "name": "Haste",
  "level": 3,
  "kind": "buff",
  "confidence": "high",
  "note": "Up to caster-level creatures in a 40-ft cube get double movement and attacks and -2 initiative. Spellcasting is not sped up. Ages each recipient 1 year. Negates slow; not cumulative.",
  "target": "area",
  "duration": {
   "kind": "rounds",
   "rounds": "3+level"
  },
  "modifiers": {
   "move_pct": 200,
   "attacks_pct": 200,
   "initiative": -2
  }
 },
 {
  "id": "slow",
  "name": "Slow",
  "level": 3,
  "kind": "buff",
  "confidence": "high",
  "note": "Up to caster-level creatures in a 40-ft cube. Half movement and attacks, +4 AC (worse), -4 to attack, Dexterity combat bonuses negated. Saves against the spell take -4. Negates haste.",
  "target": "area",
  "duration": {
   "kind": "rounds",
   "rounds": "3+level"
  },
  "save": {
   "type": "spell",
   "effect": "negates"
  },
  "modifiers": {
   "move_pct": 50,
   "attacks_pct": 50,
   "ac": 4,
   "to_hit": -4
  }
 },
 {
  "id": "improved_strength",
  "name": "Improved Strength",
  "level": 4,
  "kind": "buff",
  "confidence": "high",
  "note": "Strength gain by class group with higher caps (a bard is a rogue: 1d6+4, max 23). Each exceptional-Strength bracket counts as one point. When it ends the recipient must rest for 1d3 full turns.",
  "target": "self_or_other",
  "duration": {
   "kind": "rounds",
   "rounds": "level"
  },
  "ability_gain": {
   "str": {
    "by_group": {
     "warrior": "1d8+4",
     "priest": "1d6+4",
     "rogue": "1d6+4",
     "wizard": "1d4+4"
    },
    "max_by_group": {
     "warrior": 25,
     "priest": 23,
     "rogue": 23,
     "wizard": 21
    }
   }
  }
 },
 {
  "id": "stoneskin",
  "name": "Stoneskin",
  "level": 4,
  "kind": "buff",
  "confidence": "high",
  "note": "Blocks 1d4 attacks plus 1 per two caster levels, physical or magical; magical effects still apply their normal effects. Not cumulative with itself.",
  "target": "self_or_other",
  "duration": {
   "kind": "until_discharged"
  },
  "charges": {
   "count": "1d4+level/2",
   "unit": "attacks"
  }
 },
 {
  "id": "wall_of_ice",
  "name": "Wall of Ice",
  "level": 4,
  "kind": "utility",
  "confidence": "low",
  "note": "Breaking through costs 2 damage per inch of thickness; ice-storm mode. Not modelled.",
  "target": "none",
  "duration": {
   "kind": "rounds",
   "rounds": "10*level"
  }
 },
 {
  "id": "magic_jar",
  "name": "Magic Jar",
  "level": 5,
  "kind": "utility",
  "confidence": "high",
  "target": "none",
  "duration": {
   "kind": "special"
  }
 },
 {
  "id": "detect_magic",
  "name": "Detect Magic",
  "level": 1,
  "kind": "utility",
  "confidence": "high",
  "target": "none",
  "duration": {
   "kind": "rounds",
   "rounds": "2*level"
  }
 },
 {
  "id": "rarys_mnemonic_enhancer",
  "name": "Rary's Mnemonic Enhancer",
  "level": 4,
  "kind": "utility",
  "confidence": "high",
  "target": "none",
  "duration": {
   "kind": "rounds",
   "rounds": "1440"
  },
  "grant_slots": {
   "levels": 3
  }
 }
]
